<?xml version="1.0"?>

<workflow-definition
	xmlns="urn:liferay.com:liferay-workflow_7.4.0"
	xmlns:xsi="http://www.w3.org/2001/XMLSchema-instance"
	xsi:schemaLocation="urn:liferay.com:liferay-workflow_7.4.0 http://www.liferay.com/dtd/liferay-workflow-definition_7_4_0.xsd"
>
	<name>Chat Message Pipeline</name>
	<description>This agent provides targeted support by searching the Liferay DXP instance for the most relevant data, ensuring every response is grounded in your specific environment.</description>
	<version>1</version>
	<llm>
		<name>chatMessageHandler</name>
		<metadata>
			<![CDATA[
				{
					"xy": [
						275.0001220703125,
						243.9999771118164
					]
				}
			]]>
		</metadata>
		<labels>
			<label language-id="en_US">
				Chat Message Pipeline
			</label>
		</labels>
		<input-variables>
			<![CDATA[
[
	{
		"name": "userMessage",
		"type": "string"
	}
]
]]>
		</input-variables>
		<output-variables>
			<![CDATA[
[
	{
		"name": "assistantResponse",
		"type": "string"
	}
]
]]>
		</output-variables>
		<prompt>
			<![CDATA[You are the Liferay Knowledge Assistant, a specialized AI agent designed to assist users by retrieving accurate information specifically from the Liferay Digital Experience Platform (DXP) instance or using the chat history. Your tone is professional, helpful, and concise.]]>
		</prompt>
		<rag>
			<![CDATA[
				{
					"contentRetriever": {
						"key": "liferay"
					}
				}
			]]>
		</rag>
		<tools>
			<![CDATA[[]]]>
		</tools>
		<transitions>
			<transition>
				<labels>
					<label language-id="en_US">
						End
					</label>
				</labels>
				<name>end</name>
				<target>end</target>
				<default>true</default>
			</transition>
		</transitions>
		<user-message>
			<![CDATA[{{userMessage}}]]>
		</user-message>
	</llm>
	<state>
		<name>start</name>
		<metadata>
			<![CDATA[
				{
					"xy": [
						273,
						25
					]
				}
			]]>
		</metadata>
		<initial>true</initial>
		<labels>
			<label language-id="en_US">
				Start
			</label>
		</labels>
		<transitions>
			<transition>
				<labels>
					<label language-id="en_US">
						Chat Message Pipeline
					</label>
				</labels>
				<name>chatMessageHandler</name>
				<target>chatMessageHandler</target>
				<default>true</default>
			</transition>
		</transitions>
	</state>
	<state>
		<name>end</name>
		<metadata>
			<![CDATA[
				{
					"terminal": true,
					"xy": [
						277,
						459
					]
				}
			]]>
		</metadata>
		<labels>
			<label language-id="en_US">
				End
			</label>
		</labels>
	</state>
</workflow-definition>