<?xml version="1.0"?>

<workflow-definition
	xmlns="urn:liferay.com:liferay-workflow_7.4.0"
	xmlns:xsi="http://www.w3.org/2001/XMLSchema-instance"
	xsi:schemaLocation="urn:liferay.com:liferay-workflow_7.4.0 http://www.liferay.com/dtd/liferay-workflow-definition_7_4_0.xsd"
>
	<name>b222af88-637d-8960-e49a-74e5bf3015d8</name>
	<state>
		<name>Start</name>
		<description>Begin a workflow.</description>
		<metadata>
			<![CDATA[
				{
					"xy": [
						300,
						100
					]
				}
			]]>
		</metadata>
		<initial>true</initial>
		<labels>
			<label language-id="en_US">
				Start
			</label>
		</labels>
		<transitions>
			<transition>
				<labels>
					<label language-id="en_US">
						Transition From Start to Parent Task
					</label>
				</labels>
				<name>transitionName</name>
				<target>Parent Task</target>
				<default>true</default>
			</transition>
		</transitions>
	</state>
	<state>
		<name>End</name>
		<description>Conclude the workflow.</description>
		<metadata>
			<![CDATA[
				{
					"xy": [
						314,
						591
					],
					"terminal": true
				}
			]]>
		</metadata>
		<labels>
			<label language-id="en_US">
				End
			</label>
		</labels>
	</state>
	<task>
		<name>Parent Task</name>
		<description>Ask a user to work on the item.</description>
		<metadata>
			<![CDATA[
				{
					"xy": [
						302.15625,
						260.5
					]
				}
			]]>
		</metadata>
		<assignments>
			<user />
		</assignments>
		<labels>
			<label language-id="en_US">
				Parent Task
			</label>
		</labels>
		<transitions>
			<transition>
				<labels>
					<label language-id="en_US">
						Transition From Parent Task to Child Task 1
					</label>
				</labels>
				<name>Different Name 1</name>
				<target>Child Task 1</target>
				<default>true</default>
			</transition>
			<transition>
				<labels>
					<label language-id="en_US">
						Transition From Parent Task to Child Task 2
					</label>
				</labels>
				<name>Different Name 2</name>
				<target>Child Task 2</target>
				<default>false</default>
			</transition>
		</transitions>
	</task>
	<task>
		<name>Child Task 1</name>
		<description>Ask a user to work on the item.</description>
		<metadata>
			<![CDATA[
				{
					"xy": [
						153.15625,
						406.5
					]
				}
			]]>
		</metadata>
		<assignments>
			<user />
		</assignments>
		<labels>
			<label language-id="en_US">
				Child Task 1
			</label>
		</labels>
		<transitions>
			<transition>
				<labels>
					<label language-id="en_US">
						Transition From Child Task 1 to End
					</label>
				</labels>
				<name>transitionName</name>
				<target>End</target>
				<default>true</default>
			</transition>
		</transitions>
	</task>
	<task>
		<name>Child Task 2</name>
		<description>Ask a user to work on the item.</description>
		<metadata>
			<![CDATA[
				{
					"xy": [
						466.15625,
						407.5
					]
				}
			]]>
		</metadata>
		<assignments>
			<user />
		</assignments>
		<labels>
			<label language-id="en_US">
				Child Task 2
			</label>
		</labels>
		<transitions>
			<transition>
				<labels>
					<label language-id="en_US">
						Transition From Child Task 2 to End
					</label>
				</labels>
				<name>transitionName</name>
				<target>End</target>
				<default>true</default>
			</transition>
		</transitions>
	</task>
</workflow-definition>