<?xml version="1.0"?>

<workflow-definition
	xmlns="urn:liferay.com:liferay-workflow_7.4.0"
	xmlns:xsi="http://www.w3.org/2001/XMLSchema-instance"
	xsi:schemaLocation="urn:liferay.com:liferay-workflow_7.4.0 http://www.liferay.com/dtd/liferay-workflow-definition_7_4_0.xsd"
>
	<name>Recipe Workflow</name>
	<description>A single approver can approve a workflow content.</description>
	<version>1</version>
	<state>
		<name>created</name>
		<description>Begin a workflow.</description>
		<metadata>
			<![CDATA[
				{
					"xy": [
						165,
						76
					]
				}
			]]>
		</metadata>
		<initial>true</initial>
		<labels>
			<label language-id="en_US">
				Created
			</label>
		</labels>
		<transitions>
			<transition>
				<labels>
					<label language-id="en_US">
						Review
					</label>
				</labels>
				<name>created_review_review</name>
				<target>review</target>
				<default>true</default>
			</transition>
		</transitions>
	</state>
	<state>
		<name>approved</name>
		<description>Conclude the workflow.</description>
		<metadata>
			<![CDATA[
				{
					"terminal": true,
					"xy": [
						539,
						74
					]
				}
			]]>
		</metadata>
		<actions>
			<action>
				<name>approve</name>
				<status>0</status>
				<execution-type>onEntry</execution-type>
			</action>
			<notification>
				<name>Approve Notification</name>
				<template>
					<![CDATA[Congrats, your recipe article has been approved by ${userName}. You can find your recipe article live on <a href="https://learn.liferay.com">Learn</a> by searching the related keywords.]]>
				</template>
				<template-language>freemarker</template-language>
				<notification-type>email</notification-type>
				<notification-type>user-notification</notification-type>
				<recipients receptionType="to">
					<user />
				</recipients>
				<execution-type>onEntry</execution-type>
			</notification>
		</actions>
		<labels>
			<label language-id="en_US">
				Approved
			</label>
		</labels>
	</state>
	<task>
		<name>update</name>
		<description>Ask a user to work on the item.</description>
		<metadata>
			<![CDATA[
				{
					"xy": [
						164,
						533
					]
				}
			]]>
		</metadata>
		<actions>
			<action>
				<name>deny</name>
				<status>4</status>
				<priority>1</priority>
				<execution-type>onAssignment</execution-type>
			</action>
			<action>
				<name>pending</name>
				<status>1</status>
				<priority>2</priority>
				<execution-type>onAssignment</execution-type>
			</action>
			<notification>
				<name>Creator modification notification</name>
				<template>
					<![CDATA[Hi, your recipe article has been rejected by ${userName}, with the following comment: ${taskComments}. You may update and re-submit the recipe by logging into <a href="https://learn.liferay.com">Learn</a>.]]>
				</template>
				<template-language>freemarker</template-language>
				<notification-type>email</notification-type>
				<notification-type>user-notification</notification-type>
				<recipients receptionType="to">
					<user />
				</recipients>
				<execution-type>onAssignment</execution-type>
			</notification>
		</actions>
		<assignments>
			<user />
		</assignments>
		<labels>
			<label language-id="en_US">
				Update
			</label>
		</labels>
		<transitions>
			<transition>
				<labels>
					<label language-id="en_US">
						Resubmit
					</label>
				</labels>
				<name>resubmit</name>
				<target>review</target>
				<default>true</default>
			</transition>
		</transitions>
	</task>
	<task>
		<name>review</name>
		<description>Ask a user to work on the item.</description>
		<metadata>
			<![CDATA[
				{
					"xy": [
						165,
						290.9999771118164
					]
				}
			]]>
		</metadata>
		<actions>
			<notification>
				<name>Review notification</name>
				<template>
					<![CDATA[${userName} submitted a recipe article for review in the workflow. Please login to <a href="https://learn.liferay.com">Learn</a> to review and take action.]]>
				</template>
				<template-language>freemarker</template-language>
				<notification-type>email</notification-type>
				<notification-type>user-notification</notification-type>
				<recipients receptionType="to">
					<assignees />
				</recipients>
				<execution-type>onAssignment</execution-type>
			</notification>
		</actions>
		<assignments>
			<roles>
				<role>
					<role-id>"[#ROLE_ID:Recipe Approver#]"</role-id>
				</role>
			</roles>
		</assignments>
		<labels>
			<label language-id="en_US">
				Review
			</label>
		</labels>
		<transitions>
			<transition>
				<labels>
					<label language-id="en_US">
						Approve
					</label>
				</labels>
				<name>approve</name>
				<target>approved</target>
				<default>true</default>
			</transition>
			<transition>
				<labels>
					<label language-id="en_US">
						Reject
					</label>
				</labels>
				<name>reject</name>
				<target>update</target>
				<default>false</default>
			</transition>
		</transitions>
	</task>
</workflow-definition>