<?xml version="1.0"?>

<workflow-definition
	xmlns="urn:liferay.com:liferay-workflow_7.4.0"
	xmlns:xsi="http://www.w3.org/2001/XMLSchema-instance"
	xsi:schemaLocation="urn:liferay.com:liferay-workflow_7.4.0 http://www.liferay.com/dtd/liferay-workflow-definition_7_4_0.xsd"
>
	<name>test</name>
	<description>Test workflow definition.</description>
	<version>1</version>
	<state>
		<name>created</name>
		<metadata>
			<![CDATA[
				{
					"xy": [
						165,
						76
					]
				}
			]]>
		</metadata>
		<initial>true</initial>
		<labels>
			<label language-id="en_US">

				created

			</label>
		</labels>
		<transitions>
			<transition>
				<labels>
					<label language-id="en_US">

						review

					</label>
				</labels>
				<name>created_review_review</name>
				<target>review</target>
				<default>true</default>
			</transition>
		</transitions>
	</state>
	<state>
		<name>approved</name>
		<metadata>
			<![CDATA[
				{
					"terminal": true,
					"xy": [
						539,
						74
					]
				}
			]]>
		</metadata>
		<actions>
			<action>
				<name>approve</name>
				<status>0</status>
				<execution-type>onEntry</execution-type>
			</action>
		</actions>
		<labels>
			<label language-id="en_US">
				approved

			</label>
		</labels>
	</state>
	<task>
		<name>update</name>
		<metadata>
			<![CDATA[
				{
					"xy": [
						164,
						533
					]
				}
			]]>
		</metadata>
		<actions>
			<action>
				<name>deny</name>
				<status>4</status>
				<priority>1</priority>
				<execution-type>onAssignment</execution-type>
			</action>
			<action>
				<name>pending</name>
				<status>1</status>
				<priority>2</priority>
				<execution-type>onAssignment</execution-type>
			</action>
			<notification>
				<name>Creator Modification Notification</name>
				<template>
					<![CDATA[Your submission was rejected by ${userName}, please modify and resubmit.
]]>

				</template>
				<template-language>freemarker</template-language>
				<notification-type>email</notification-type>
				<notification-type>user-notification</notification-type>
				<recipients receptionType="to">
					<user />
				</recipients>
				<execution-type>onAssignment</execution-type>
			</notification>
		</actions>
		<assignments>
			<user />
		</assignments>
		<labels>
			<label language-id="en_US">
				update

			</label>
		</labels>
		<transitions>
			<transition>
				<labels>
					<label language-id="en_US">
						resubmit

					</label>
				</labels>
				<name>resubmit</name>
				<target>review</target>
				<default>true</default>
			</transition>
		</transitions>
	</task>
	<task>
		<name>review</name>
		<description>Ask a user to work on the item.</description>
		<metadata>
			<![CDATA[
				{
					"xy": [
						165,
						292
					]
				}
			]]>
		</metadata>
		<actions>
			<notification>
				<name>Review Notification</name>
				<template>
					<![CDATA[${userName} sent you a ${entryType} for review in the workflow.]]>
				</template>
				<template-language>freemarker</template-language>
				<notification-type>email</notification-type>
				<notification-type>user-notification</notification-type>
				<recipients receptionType="to">
					<assignees />
				</recipients>
				<execution-type>onAssignment</execution-type>
			</notification>
			<notification>
				<name>Review Completion Notification</name>
				<template>
					<![CDATA[Your submission was reviewed<#if taskComments?has_content> and the reviewer applied the following ${taskComments}</#if>.]]>
				</template>
				<template-language>freemarker</template-language>
				<notification-type>email</notification-type>
				<recipients receptionType="to">
					<user />
				</recipients>
				<execution-type>onExit</execution-type>
			</notification>
		</actions>
		<assignments>
			<roles>
				<role>
					<role-type>regular</role-type>
					<name>Administrator</name>
					<auto-create>false</auto-create>
				</role>
			</roles>
		</assignments>
		<labels>
			<label language-id="en_US">
				review

			</label>
		</labels>
		<transitions>
			<transition>
				<labels>
					<label language-id="en_US">						approve

					</label>
				</labels>
				<name>approve</name>
				<target>approved</target>
				<default>true</default>
			</transition>
			<transition>
				<labels>
					<label language-id="en_US">						reject
					</label>
				</labels>
				<name>reject</name>
				<target>update</target>
				<default>false</default>
			</transition>
		</transitions>
	</task>
</workflow-definition>